identifier	pos	stem	morphology	number	case	psx	comment	figurative	grabbing	temporal	existential	non-finite	meaning_fin	predicate	rel_nouns_noun?	form	sentence
0318	NOUN	джодж	джодж-ӧд-ыс	sg	prl	FALSE	NA	NA	NA	NA	NA	NA	konttaavat lattiaa pitkin	кыскасьӧны	NA	джоджӧдыс	Няйт ДЖОДЖӦДЫС челядьясыс кыскасьӧны.
0319	ADP	выв	выв-ті	sg	tra	FALSE	NA	NA	NA	NA	NA	NA	maata pitkin kiskova jalka (?) on samanlainen kuin…	кыскасьысь	му	вывті	Сэтшӧм му ВЫВТІ кыскасьысь кокыс вужкоккӧд ӧткодь.
0320	ADP	выв	выв-ті	sg	tra	FALSE	Tila	NA	NA	NA	NA	NA	vetää hiekkaa pitkin	кыскӧ	лыаа	вывті	Шӧркоддьӧм уджӧн жӧ лыддьыссьӧ, сійӧ жӧ кӧ вӧлыс сы мында жӧ груз сы ылнаӧдз жӧ кыскӧ гырысь лыаа ВЫВТІ либӧ посни галяа вывті.
0321	ADP	выв	выв-ті	sg	tra	FALSE	Tila	NA	NA	NA	NA	NA	vetää kivikkoa pitkin	кыскӧ	галяа	вывті	Шӧркоддьӧм уджӧн жӧ лыддьыссьӧ, сійӧ жӧ кӧ вӧлыс сы мында жӧ груз сы ылнаӧдз жӧ кыскӧ гырысь лыаа вывті либӧ посни галяа ВЫВТІ.
0322	NOUN	сӧн	сӧн-ъяс-ӧд	pl	prl	FALSE	Väylä (distr.)	NA	NA	NA	NA	NA	kiskoo-kerää suonia pitkin	кыскӧ-чукӧртчӧ	NA	сӧнъясӧд	Сэсся ас пытшкас яйысь босьтӧ став ковтӧмторъяссӧ да вена нима СӦНЪЯСӦД кыскӧ-чукӧртчӧ бӧр сьӧлӧмӧ.
0323	NOUN	туй	туй-яс-ӧд	pl	prl	FALSE	Väylä	NA	NA	NA	NA	NA	vetää teitä pitkin	кыскыны	NA	туйясӧд	Татшӧм нога двуколкаа доддясянъясыс бурӧсь сійӧн, мый, первой-кӧ, ӧти чӧрсысла омӧльджыка паныдалӧ тшупӧдъясӧд, мӧд-кӧ, джуджыд кӧльӧсаысла кокниджык кыскыны лёк ТУЙЯСӦД, омӧльджыка вӧйӧны кӧльӧсаясыс няйтӧ да лыаӧ, коймӧд-кӧ, татшӧм телеганас кокниджык бергавны мӧд пӧлӧс телега дорысь, дай нёльӧд-кӧ, бурджыка вичмӧдӧ вӧвъяслысь вын.
0324	ADP	выв	выв-ті	sg	tra	FALSE	Väylä	NA	NA	NA	NA	NA	vetää (hieman) veitsen myötäisesti	кыскыштӧ	пурт	вывті	Рот вундалысь босьтӧ ротсӧ да пуктӧ пурт вылӧ да кыскыштӧ пурт ВЫВТІ асланьыс.
0325	ADP	пӧвст	пӧвст-ті	sg	tra	FALSE	NA	NA	NA	NA	NA	NA	laahustivat heinän läpi	кыссисны	турун	пӧвстті	А казакъяс турун ПӦВСТТІ кыссисны нин куимӧн-куимӧн, нёльӧн-нёльӧн, ӧткӧн-ӧткӧн.
0326	ADP	пӧвст	пӧвст-ті	sg	tra	FALSE	NA	NA	NA	NA	NA	NA	laahustavat heinän läpi	кыссьӧны	турун	пӧвстті	И вот найӧ шыбласьӧны нин канаваӧ, кыссьӧны турун ПӦВСТТІ, старайтчӧны воӧдчыны кыдз позьӧ матӧджык.
0327	NOUN	туй	туй-ӧд	sg	prl	FALSE	NA	NA	NA	NA	NA	NA	kiertävät omaa tietään	кытшалӧны	NA	туйӧд	Став планетаыс кытшлалӧны Шонді гӧгӧр асланыс ТУЙӦД.
0328	NOUN	боки	боки-ті-ыс	sg	tra	TRUE	Väylä	NA	NA	NA	NA	TRUE	reunaa pitkin kiertäen	кытшӧмӧн	NA	бокитіыс	Эз главнӧй уличаӧдыс, а БОКИТІЫС, градйӧръясӧд — кытшӧмӧн.
0329	NOUN	градйӧр	градйӧр-ъяс-ӧд	pl	prl	FALSE	NA	NA	NA	NA	NA	TRUE	puutarhoissa kiertäen	кытшӧмӧн	NA	градйӧръясӧд	Эз главнӧй уличаӧдыс, а бокитіыс, ГРАДЙӦРЪЯСӦД — кытшӧмӧн.
0330	ADV	кос	кос-ті	NA	tra	NA	NA	NA	NA	NA	NA	NA	NA	NA	NA	кості	Ревматизм висьӧм вӧсна мукӧд пӧлӧс лоӧм чорыд висьӧмъяс дерт КОСТІ жӧ дженьмӧдӧны мортлысь нэмсӧ.
0331	ADV	кос	кос-ті	NA	tra	NA	NA	NA	NA	NA	NA	NA	NA	вайӧны	NA	кості	Францияын быд во чужӧ лёквисьӧмӧн висьысь нывбабаяслӧн 20.000 кага шой да 4.000 кымынӧс КОСТІ вайӧны.
0332	NOUN	улича	улича-ӧд-ыс	sg	prl	TRUE	Väylä	NA	NA	NA	NA	TRUE	tietä pitkin kiertäen	кытшӧмӧн	NA	уличаӧдыс	Эз главнӧй УЛИЧАӦДЫС, а бокитіыс, градйӧръясӧд — кытшӧмӧн.
0333	NOUN	сӧн	сӧн-ӧд-ыс	sg	prl	TRUE	Väylä	NA	NA	NA	NA	NA	(yhtä) suonea pitkin tulee (puhdas) veri	локтӧ	NA	сӧнӧдыс	Ӧти СӦНӦДЫС мамсяньыс локтӧ кагалы гӧрд, мича вир.
0334	NOUN	труба	труба-яс-ті	pl	tra	FALSE	Väylä (distr.)	NA	NA	NA	NA	NA	tulee puisia putkia pitkin	локтӧ	NA	пу трубаясті	Сӧстӧм сынӧдыс локтӧ ПУ ТРУБАЯСТІ, кодъясӧс сувтӧдалӧма стойла оланін пельӧсъясӧ.
0335	NOUN	провод	провод-ъяс-ӧд	pl	prl	FALSE	NA	NA	NA	NA	NA	TRUE	lankoja pitkin tuleva (sähkövirta)	локтысь	NA	проводъясӧд	Станциясянь ПРОВОДЪЯСӦД локтысь токсӧ электромотор пӧртӧ механическӧй вынӧ.
0336	NOUN	бок	бок-ӧд	sg	prl	FALSE	NA	NA	NA	NA	TRUE	NA	tulee olemaan vieressä	лоӧ	NA	бокӧд	Пу гӧгӧр кырсь чуктӧмысь пуыс кулӧ, а ӧти БОКӦД чуктӧмысь лоӧ кос бока.
0337	ADP	водз	водз-ті	sg	tra	FALSE	Tila	NA	NA	NA	NA	NA	kiinnittelivät laitteen eteen (leikkurin)	лӧсьӧдлісны	машина	водзті	Нянь вундӧм вылӧ машина ВОДЗТІ лӧсьӧдлісны ытшкан машина модааӧс.
0338	NOUN	грезд	грезд-ӧд	sg	prl	FALSE	NA	NA	NA	NA	NA	NA	(tie) oli tehty kylää pitkin	лӧсялӧма	NA	грездӧд	Гашкӧ эськӧ вирнад найӧ дзикӧдз матайтчисны да, буретш сійӧ кадас доктор Сеттелы сійӧ ГРЕЗДӦД туй лӧсялӧма.
0339	ADP	кост	кост-ӧд	sg	prl	FALSE	Aukko	NA	NA	NA	NA	NA	ampui rakojen välistä	лыйліс	щельяс	костӧд	Ворошилов лыйліс маузерысь векньыдик боевӧй щельяс КОСТӦД, выбор вылӧ, ӧтикӧн: тайӧс забор дінсьыс…
0340	NOUN	сынӧд	сынӧд-ӧд	sg	prl	FALSE	Väylä (3-ulott.)	NA	NA	NA	NA	NA	ilman läpi lentäminen	лэбалан	NA	сынӧдӧд	Шоныд сынӧда шаръяс пыдди, кодъяс вермисны овны сынӧдас сӧмын некымын минут кытчӧдз шар пытшса сынӧдыс эз кӧдзав, лоисны СЫНӦДӦД лэбалан ёна бурджык да гырысьджык аппаратъяс — водород тыра шаръяс.
0341	NOUN	сынӧд	сынӧд-ті	sg	tra	FALSE	Tila	NA	NA	NA	NA	TRUE	ilman läpi lentäminen	лэбалан	NA	сынӧдті	Италия вӧчліс СЫНӦДТІ лэбалан джынвыйӧ чорыд вель уна карабъяс, ыджданас 1000 кубическӧй метрсянь 61000 кубическӧй метрӧдз*.
0342	NOUN	сынӧд	сынӧд-ті	sg	tra	FALSE	Tila	NA	NA	NA	NA	TRUE	ilman läpi lentäminen	лэбалан	NA	сынӧдті	Лоӧ нӧшта кымынкӧ кыв висьтавны СЫНӦДТІ лэбалан медбӧръя типа немецкӧй джынвыйӧ чорыд карабъяс йылысь.
0343	NOUN	сынӧд	сынӧд-ті	sg	tra	FALSE	Tila	NA	NA	NA	NA	TRUE	ilman läpi lentäminen	лэбалан	NA	сынӧдті	Ӧні ёна мунӧны лӧсьӧдчан уджъяс Войвыв ыджыд туй (Великий северный путь) вӧчӧм кузя; сэні лоӧны и кӧрт туйяс и ва туйяс, и СЫНӦДТІ лэбалан туйяс.
0344	NOUN	сынӧд	сынӧд-ті	sg	tra	FALSE	Tila	NA	NA	NA	NA	TRUE	ilman läpi lentäminen	лэбалан	NA	сынӧдті	СЫНӦДТІ лэбалан карабъясыд часнад тӧвзьыштӧны 128 140 километрӧдз.
0345	NOUN	сынӧд	сынӧд-ті	sg	tra	FALSE	Tila	NA	NA	NA	NA	TRUE	ilman läpi lentäminen	лэбалан	NA	сынӧдті	СЫНӦДТІ лэбалан чорыд караблӧн медтӧдчана, главнӧй часьтыс — решётка кодь металлическӧй каркас дирижабль формаа.
0346	NOUN	сынӧд	сынӧд-ті	sg	tra	FALSE	Tila	NA	NA	NA	NA	TRUE	ilman läpi lentäminen	лэбалан	NA	сынӧдті	СЫНӦДТІ лэбалан чорыд карабъяс пиысь позьӧ индыны «Цеппелин» вылӧ.
0347	NOUN	сынӧд	сынӧд-ті	sg	tra	FALSE	Tila	NA	NA	NA	NA	TRUE	ilman läpi lentävä	лэбалан	NA	сынӧдті	Тайӧ СЫНӦДТІ лэбалан гигант, сійӧс вӧчӧмыс (мувывса сооруженньӧяс — мачтаяс, эллингъяс да мукӧдторъяс лыддьытӧгыс на) сувтӧ 4 миллион шайтӧдз, сообщенньӧын збыльвылӧ чудесаяс вӧчӧ.
0348	NOUN	сынӧд	сынӧд-ті	sg	tra	FALSE	Tila	NA	NA	NA	NA	TRUE	ilman läpi lentävä	лэбалан	NA	сынӧдті	Эмӧсь СЫНӦДТІ лэбалан веськӧдлан небыд, джынвыйӧ чорыд да чорыд дирижабльяс.
0349	NOUN	сынӧд	сынӧд-ті	sg	tra	FALSE	Tila	NA	NA	NA	NA	TRUE	ilman kautta lentämisreitti	лэбалан туй	NA	сынӧдті	Миянлы колӧ ӧні жӧ збыльысь чорыда босьтчыны сёрнитны Мӧскуасянь Дальнӧй Востокӧ, Сахалинӧ, Камчаткаӧ да мукӧдлаӧ СЫНӦДТІ лэбалан туйяс лӧсьӧдӧм йылысь.
0350	NOUN	сынӧд	сынӧд-ті	sg	tra	FALSE	Tila	NA	NA	NA	NA	TRUE	ilman kautta lentämisreittejä	лэбалан туйястӧ	NA	сынӧдті	Сэсся ӧд сыысь кындзи СЫНӦДТІ лэбалан туйястӧ восьтӧмыд йитас ылын местаяссӧ центръяскӧд, во гӧгӧр чӧж позьны кутас йитӧдсӧ кутны, а сійӧ зэв коланатор экономика да политика боксянь.
0351	NOUN	закод	закод-ӧд-ыд	sg	prl	TRUE	NA	NA	NA	NA	NA	NA	(ötökät) lentävät käymälän läpi	лэбаласны	NA	закодӧдыд	Вӧлӧмкӧ, гутъясыд ЗАКОДӦДЫД лэбаласны, висьысь нывбабалысь микроба асмогтӧ сёясны, сэсся — йӧв вылӧ, йӧв дозъясӧ.
0352	NOUN	сынӧд	сынӧд-ті	sg	tra	FALSE	Tila	NA	NA	NA	NA	NA	lentää ilman läpi	лэбалӧ	NA	сынӧдті	СЫНӦДТІ лэбалӧ, оз усь и аэроплан.
0353	NOUN	сынӧд	сынӧд-ӧд	sg	prl	FALSE	Väylä (3-ulott.)	NA	NA	NA	NA	NA	ilman läpi lentämisen (historia)	лэбалӧмлӧн	NA	сынӧдӧд	СЫНӦДӦД лэбалӧмлӧн историяыс нӧшта на петкӧдлӧ, кутшӧм ыджыд тыдаланалун босьтӧ сійӧ машина, коді пырӧ кутшӧмкӧ техника отрасльӧ.
0354	NOUN	сынӧд	сынӧд-ӧд	sg	prl	FALSE	Väylä (3-ulott.)	NA	NA	NA	NA	NA	ilmaa pitkin lentämisen	лэбалӧмлысь	NA	сынӧдӧд	Империалистическӧй война ёна ӧддзӧдіс СЫНӦДӦД лэбалӧмлысь быдмӧмсӧ.
0355	NOUN	сынӧд	сынӧд-ті	sg	tra	FALSE	Tila	NA	NA	NA	NA	NA	ilman läpi lentämisessä	лэбалӧмын	NA	сынӧдті	Кутшӧм достиженньӧяс эмӧсь став му вылас СЫНӦДТІ лэбалӧмын, позьӧ аддзыны со кутшӧм лыдпасъясысь (видзӧд 24 листбок):
0356	NOUN	сынӧд	сынӧд-ті	sg	tra	FALSE	Tila	NA	NA	NA	NA	NA	ilman läpi lentämisessä	лэбалӧмын	NA	сынӧдті	Немечьяслӧн СЫНӦДТІ лэбалӧмын гырысь достиженньӧясыс тшӧктӧны збыльысь ёна босьтсьыны и миян Союзын гырысь дирижабльяс лӧсьӧдӧмас.
0357	NOUN	керка	керка-яс-ӧд	pl	prl	FALSE	NA	NA	NA	NA	NA	NA	lentävät talojen poikki	лэбалӧны	NA	керкаясӧд	Жар гожӧмын найӧ сё сюрсъясӧн лэбалӧны керкаяс гӧгӧр, КЕРКАЯСӦД.
0358	NOUN	сынӧд	сынӧд-ті	sg	tra	FALSE	Tila	NA	NA	NA	NA	NA	lentävät ilman läpi	лэбалӧны	NA	сынӧдті	Ми вермам кыксё километрӧн час мунны поездъяс вылын либӧ автомобильӧн; ассьыс сёрнисӧ ӧні мортыд вермӧ уна сюрс километр сайӧ мӧдӧдны радио кузя; йӧзыд лэбачьяс моз СЫНӦДТІ лэбалӧны саридзьяс (море) сайӧ да сідз водзӧ!
0359	ADP	выв	выв-ті	sg	tra	FALSE	Tila	NA	NA	NA	NA	NA	lentää vuoren yli	лэбас	гӧра	вывті	Сэтшӧм ӧдйӧ лэбигӧн снарад кытшовтас Мутӧ часӧн-джынйӧнӧн; сы бӧрын сійӧ выльысь лэбас лыйсян гӧра ВЫВТІ.
0360	NOUN	сынӧд	сынӧд-ті	sg	tra	FALSE	Tila	NA	NA	NA	NA	NA	ilman läpi lentäen	лэбигӧн	NA	сынӧдті	СЫНӦДТІ лэбигӧн из ниртчӧ сынӧдас, сыысь зэв ёна доналӧ.
0361	ADP	туй	туй-ӧд	sg	prl	FALSE	NA	TRUE	NA	NA	NA	NA	lentää ruuvin (kierteen?) tavalla	лэбӧ	винта	туйӧд	Сійӧ лэбӧ пространствоын быттьӧ винта ТУЙӦД (17ʼ серп.).
0362	NOUN	пространство	пространство-ӧд	sg	prl	FALSE	NA	NA	NA	NA	NA	NA	lentävät avaruutta pitkin	лэбӧны	NA	пространствоӧд	Кометаыд — сійӧ прӧстӧй, абу зэв ыджыд бус да из чукӧр, кодъяс ӧтгудырйӧ лэбӧны ПРОСТРАНСТВОӦД.
0363	NOUN	сынӧд	сынӧд-ті	sg	tra	FALSE	Tila	NA	NA	NA	NA	NA	lentävät ilman läpi	лэбӧны	NA	сынӧдті	Сідзи позьӧ шуны лыйӧм пуляяс йылысь, снарадъяс йылысь, кор найӧ лэбӧны СЫНӦДТІ.
0364	ADP	кост	кост-ӧд	sg	prl	FALSE	NA	NA	NA	NA	NA	NA	joiden välistä laskivat	лэдзисны	кодъяс	костӧд	Сійӧ вӧлі вӧчӧма кык валикысь, кодъяс КОСТӦД лэдзисны сутуга либӧ вӧсньыдик ота металл.
0365	ADV?	кутшӧм	кутшӧм-ъяс-ӧд	NA	prl	NA	NA	NA	NA	NA	NA	NA	NA	NA	NA	кутшӧмъясӧд	Партия хvі съезд вылын Сталин ёрт индіс: «Миянлы пӧ колӧ мунны (скӧт видзӧмын А. К.) сійӧ жӧ туйясӧд, КУТШӦМЪЯСӦД мунім зернӧвӧй проблема разрешитігӧн, мӧд ногӧн кӧ, — совхозъяс да колхозъяс котыртӧм пыр».
0366	ADV	кы	кы-ті	NA	tra	NA	NA	NA	NA	NA	NA	NA	NA	NA	NA	кыті	— Висьтав, КЫТІ тэнад висьӧ, мый сэки тэкӧд лолӧ?
0367	ADV	кы	кы-ті	NA	tra	NA	NA	NA	NA	NA	NA	NA	NA	NA	NA	кыті	— Волывлы, — шуӧ, — татчӧ частӧджык, видзӧд, тӧдмав, КЫТІ мый, кыдзи вӧчсьӧ, отсасьны талы кутан.
0368	ADV	кы	кы-ті	NA	tra	NA	NA	NA	NA	NA	NA	NA	NA	NA	NA	кыті	2) увтас видзьяс (КЫТІ увтаслаыс, вывті васӧдлаыс оз туй муяс вылӧ);
0369	ADV	кы	кы-ті	NA	tra	NA	NA	NA	NA	NA	NA	NA	NA	NA	NA	кыті	8) Платформа вылӧ турун лэптыссьӧ габарит серти (джуджыда-ӧ тӧрӧ кӧрт туй посъяс увті, КЫТІ лоӧ мунны платформалы) да овлӧ обычнӧя 2,5 м судта.
0370	ADV	кы	кы-ті	NA	tra	NA	NA	NA	NA	NA	NA	NA	NA	NA	NA	кыті	Вевдорас кӧрт листъясысь вӧчӧны тшын петан туй, КЫТІ тшыныс бергӧдчӧ кык пӧв, да вевдорсӧ вольсалӧны кирпичӧн.
0371	ADV	кы	кы-ті	NA	tra	NA	NA	NA	NA	NA	NA	NA	NA	NA	NA	кыті	Весавны заводиттӧдз первой ниралӧны идзасысь вӧчӧм гӧрӧдӧн сійӧ местаяс, КЫТІ няйтӧссьӧма да пӧсялӧма, сэсся весалӧны тшӧткаӧн.
0372	ADV	кы	кы-ті	NA	tra	NA	NA	NA	NA	NA	NA	NA	NA	NA	NA	кыті	Гадьяс гӧгӧрыс гартӧмаӧсь зэв уна посньыдик трубочкаясӧн, КЫТІ ветлӧ вир.
0373	ADV	кы	кы-ті	NA	tra	NA	NA	NA	NA	NA	NA	NA	NA	NA	NA	кыті	Голясӧ, киняувъяссӧ, пель сайяссӧ, кокъяс костсӧ — быдлаті, КЫТІ кусыня кучикыс — косьтыны сӧмын личкыштӧмӧн: небыдика тап-тап вӧчышт.
0374	ADV	кы	кы-ті	NA	tra	NA	NA	NA	NA	NA	NA	NA	NA	NA	NA	кыті	Гу колӧ кодйыны кытчӧкӧ бокӧ и мед абу матын оланінсянь да КЫТІ оз ветлӧдлы скӧт, кытчӧ немтор оз кӧдзны, оз вӧдитны пуктасъяс да кытысь оз перйыны сёй ни лыа.
0375	ADV	кы	кы-ті	NA	tra	NA	NA	NA	NA	NA	NA	NA	NA	NA	NA	кыті	Десятичнӧй вески вылӧ вӧчсьӧ клетка, кодлӧн ӧти бокыс увлань воссяна да КЫТІ куканьсӧ веситігӧн йӧртсьӧ.
0376	ADV	кы	кы-ті	NA	tra	NA	NA	NA	NA	NA	NA	NA	NA	NA	NA	кыті	Ёнджыка кӧлӧ мыськавны киняувтӧ да мукӧдлаті, КЫТІ ёнджыка пӧсялӧ (ньылӧдӧ).
0377	ADV	кы	кы-ті	NA	tra	NA	NA	NA	NA	NA	NA	NA	NA	NA	NA	кыті	Заразатӧ колӧ бырӧдны скӧт видзанінтӧ пелькӧдӧмӧн, чышкӧмӧн-мыськӧмӧн, шондіыд нӧ отсалас вины коляс заразасӧ (стенъяссьыс, джоджсьыс, няйтсьыс, буссьыс, — КЫТІ он вермы мыськыны, чышкыны).
0378	ADV	кы	кы-ті	NA	tra	NA	NA	NA	NA	NA	NA	NA	NA	NA	NA	кыті	Ковмас корсьысьны, КЫТІ сотчӧ.
0379	ADV	кы	кы-ті	NA	tra	NA	NA	NA	NA	NA	NA	NA	NA	NA	NA	кыті	Кор пӧжарыс ёна нин паськыда босьтсьӧма да рабочӧй выныс оз тырмы пӧжарсӧ кытшӧ босьтны, — колӧ мыйкӧ мында йӧзӧс сувтӧдны пӧжар бокъяс пӧлӧн, КЫТІ биыс ньӧжйӧджык мунӧ главнӧй направленньӧ серти.
0380	ADV	кы	кы-ті	NA	tra	NA	NA	NA	NA	NA	NA	NA	NA	NA	NA	кыті	Кӧтасьӧм сю бӧж ёна польдӧ, чужӧ да артмӧ ёна топыд эж, КЫТІ сынӧдыд некутшӧма нин оз пыр.
0381	ADV	кы	кы-ті	NA	tra	NA	NA	NA	NA	NA	NA	NA	NA	NA	NA	кыті	кыдзиджык заводитны, мыйджык вӧчны, васӧдінъяс косьтігӧн, КЫТІ да кодарӧ канаваяс кодйыны, ещӧ нин гырысь нюръяс косьтігӧн; сідз жӧ и мыръяс перйигӧн.
0382	ADV	кы	кы-ті	NA	tra	NA	NA	NA	NA	NA	NA	NA	NA	NA	NA	кыті	КЫТІ доймалӧны кокъясыс, пырджык видзӧны кӧртӧдӧн.
0383	ADV	кы	кы-ті	NA	tra	NA	NA	NA	NA	NA	NA	NA	NA	NA	NA	кыті	КЫТІ ӧтлаасьӧны (вуджӧны мӧда-мӧднысӧ) визьяс, сэні и лоӧ пӧжар местаыс.
0384	ADV	кы	кы-ті	NA	tra	NA	NA	NA	NA	NA	NA	NA	NA	NA	NA	кыті	Мед планкаясыс топыдджыка жмитчисны жӧлӧб бердас, жӧлӧб пыдӧсас кодйӧны орччӧн кык бӧрӧздакодьӧс, КЫТІ и ветлӧны гезъясыс.
0385	ADV	кы	кы-ті	NA	tra	NA	NA	NA	NA	NA	NA	NA	NA	NA	NA	кыті	Медбы косьтыны, тулыссяньыс лым сылігас колӧ пасъявны бедьясӧн сэтшӧм местаяссӧ, КЫТІ лым ваыс ёнджыка мунӧ.
0386	ADV	кы	кы-ті	NA	tra	NA	NA	NA	NA	NA	NA	NA	NA	NA	NA	кыті	Медым кудзыс визувтіс бокӧ, джоджсӧ скӧт сулаланінас колӧ вӧчны неуна пӧлӧнджык, ичӧтик канава кодьӧн, КЫТІ кудзыс вермас визувтны скӧт оланінсяньыс ылӧджык.
0387	ADV	кы	кы-ті	NA	tra	NA	NA	NA	NA	NA	NA	NA	NA	NA	NA	кыті	Мортыслӧн яяс эм зэв уна сӧнъяс, КЫТІ сувтлытӧг ветлӧ мортлӧн вирыс.
0388	ADV	кы	кы-ті	NA	tra	NA	NA	NA	NA	NA	NA	NA	NA	NA	NA	кыті	Найӧс сэні видлалӧны, юасьӧны, КЫТІ да кыдзи висьӧ, кор кыдзи висьмис; велӧдӧны кыдзи бурдӧдчыны, кыдзи овны, медым регыдджык бурдан.
0389	ADV	кы	кы-ті	NA	tra	NA	NA	NA	NA	NA	NA	NA	NA	NA	NA	кыті	Несолончаковӧй степъяс вылысь, КЫТІ войдӧр уджавлӧмаӧсь, пуктыссьӧ медбур пырей турун, абу кӧ сійӧ ёна сорласьӧма полынь турунӧн.
0390	ADV	кы	кы-ті	NA	tra	NA	NA	NA	NA	NA	NA	NA	NA	NA	NA	кыті	Нига индас кор, КЫТІ ывлавылысь позьӧ тӧдмавны.
0391	ADV	кы	кы-ті	NA	tra	NA	NA	NA	NA	NA	NA	NA	NA	NA	NA	кыті	ӧтиас — площадькодьӧс, кытчӧ чукӧрмӧ вольӧсыс да асмогыс; мӧдӧс — жӧлӧб (ворга), КЫТІ визувтӧ куйӧд ваыс.
0392	ADV	кы	кы-ті	NA	tra	NA	NA	NA	NA	NA	NA	NA	NA	NA	NA	кыті	Петӧ живицаыс вевдорас, КЫТІ пуыслӧн кырсьыс потӧма дзик пуӧдзыс.
0393	ADV	кы	кы-ті	NA	tra	NA	NA	NA	NA	NA	NA	NA	NA	NA	NA	кыті	Платформа вылӧ турун лэптыссьӧ габарит серти (джуджыда-ӧ тӧрӧ кӧрт туй посъяс увті, КЫТІ лоӧ мунны платформалы) да овлӧ обычнӧя 2,5 м судта.
0394	ADV	кы	кы-ті	NA	tra	NA	NA	NA	NA	NA	NA	NA	NA	NA	NA	кыті	Посни турун — пуктыссьӧ вылын местаясысь, КЫТІ ваыс босьтлывлӧ не быд во да кытысь туруныс омӧля торъялӧ дав выв турун дінысь.
0395	ADV	кы	кы-ті	NA	tra	NA	NA	NA	NA	NA	NA	NA	NA	NA	NA	кыті	Пуысь вӧчӧм джоджув колӧ цементавны. Цементавнысӧ колӧ пӧкатӧн, КЫТІ пондас визувтны куйӧд ваыс канаваясӧ.
0396	ADV	кы	кы-ті	NA	tra	NA	NA	NA	NA	NA	NA	NA	NA	NA	NA	кыті	Пырей быдман районъяс основнӧя позьӧ юкны кык пельӧ: первой — степъяс вылын сэтшӧм местаяс, КЫТІ выльӧн на гӧрлӧмаӧсь, но эновтӧмаӧсь, сетӧны тадзи шусян «пырей турун».
0397	ADV	кы	кы-ті	NA	tra	NA	NA	NA	NA	NA	NA	NA	NA	NA	NA	кыті	Силос башня вевт вылас колӧ лоны розь, КЫТІ сюявсьӧ силосуйтан кӧрымыс.
0398	ADV	кы	кы-ті	NA	tra	NA	NA	NA	NA	NA	NA	NA	NA	NA	NA	кыті	Сы вӧсна курӧгпиян и вермӧны бӧрйыны аслыныс места, КЫТІ налы колӧ.
0399	ADV	кы	кы-ті	NA	tra	NA	NA	NA	NA	NA	NA	NA	NA	NA	NA	кыті	Сэні тракторлы эм КЫТІ ветлӧдлыны.
0400	ADV	кы	кы-ті	NA	tra	NA	NA	NA	NA	NA	NA	NA	NA	NA	NA	кыті	Та вылӧ прӧсекъяс паськӧдчӧны 15 метрӧдз да лӧсьӧдчӧны сідзи, медым найӧс позис используйтны вӧр кыскалан туй пыдди да мукӧдлаӧ, шуам вӧрсӧ бурджыка видзӧм вылӧ, а пӧжаръяс дырйи — кусӧдчыны йӧзӧс регыдджыка веськӧдӧм вылӧ, сійӧ местаас, КЫТІ сотчӧ.
0401	ADV	кы	кы-ті	NA	tra	NA	NA	NA	NA	NA	NA	NA	NA	NA	NA	кыті	Тадзи видлалӧмӧн миян оз коль ньӧти видлавтӧм места, КЫТІ эськӧ вӧлі доя либӧ висяна ин вӧвлӧн.
0402	ADV	кы	кы-ті	NA	tra	NA	NA	NA	NA	NA	NA	NA	NA	NA	NA	кыті	Тадзи колӧ пасъясьны, медым тӧдны КЫТІ да кодарлань кодйыны канаваяс — валы визувтан туй.
0403	ADV	кы	кы-ті	NA	tra	NA	NA	NA	NA	NA	NA	NA	NA	NA	NA	кыті	Тайӧ лёквисьӧмыс индӧ миянлы туйсӧ, кӧні уна омӧльторлӧн вужйыс, КЫТІ колӧ орӧдны сійӧс.
