identifier	pos	stem	morphology	number	case	psx	comment	figurative	grabbing	temporal	existential	non-finite	meaning_fin	predicate	rel_nouns_noun?	form	sentence
0565	ADP	пӧлӧн	пӧлӧн-ӧд-ыс	sg	prl	TRUE	Väylä (2-ulott.)	NA	NA	NA	NA	NA	ei pidä muokata (kanavia) kasvavaa nuorta metsää pitkin	оз ков вӧчавны	быдмысь том вӧр	пӧлӧнӧдыс	Тайӧ визьяссӧ (канаваяссӧ) оз ков вӧчавны дзик быдмысь том вӧр ПӦЛӦНӦДЫС, а сыысь водзӧджык, этша вылӧ 30 метр сайӧ.
0566	ADP	берд	берд-ті-ыс	sg	tra	TRUE	Tila	NA	NA	NA	NA	NA	ei pidä leikata lihan reunasta	оз ков вундыны	яй	бердтіыс	Оз ков вундыны сійӧс дзик яй БЕРДТІЫС либӧ кольны вывті кузя (5-ӧд серп.).
0567	NOUN	гӧгй	гӧгй-ӧд-ыд	sg	prl	TRUE	Aukko	NA	NA	NA	NA	NA	ei pidä viedä navan kautta (likaa lapseen)	оз ков кыскыны	NA	гӧгйӧдыд	Сюв кодь ГӦГЙӦДЫД няйттӧ оз ков кыскыны, мед оз орлась, оз коль няйтысь весиг ӧти чир маткаӧ.
0568	NOUN	вӧр	вӧр-ті	sg	tra	FALSE	Tila	NA	NA	NA	NA	NA	ei pidä samota metsää pitkin	оз ковны келавны	NA	вӧрті	Нюръяссӧ кӧ ӧтувтчӧмӧн косьтыны пӧскӧтина улӧ, сэки асьнымӧс ёна кокньӧдам: оз ков мӧстӧ корсигӧн келавны лядьвей вужйӧдзыд няйтын да ваын, оз ковмы ВӦРТІ келавны.
0569	NOUN	кост	кост-ӧд-ыс	sg	prl	TRUE	Aukko	NA	NA	NA	NA	NA	ettei (tuuli) ala menemään raosta	оз кут ветлӧдлыны	NA	костӧдыс	Быд крестьянин керка лэптігӧн кер костъяссӧ, пазъяссӧ нитшкалӧ, медым кӧдзыд сынӧд оз кут ветлӧдлыны КОСТӦДЫС.
0570	NOUN	выв	выв-ті-ыс	sg	tra	TRUE	Tila	NA	NA	NA	NA	NA	(lehmä) ei nouse menemään päältä	оз лыб мунны	NA	вывтіыс	ВЫВТІЫС весиг морт оз лыб мунны, непӧштӧ скӧт.
0571	NOUN	гырддза	гырддза-ӧд	sg	prl	FALSE	Tila	NA	NA	NA	NA	NA	(sairaat) eivät taivu kyynärpäästä	оз нюклясьны	NA	гырддзаӧд	Первойсӧ висьысьыд норасьлӧ, суставъяс пӧ висьӧны, оз бура нюклясьны (пидзӧсӧд, ГЫРДДЗАӦД).
0572	NOUN	пидзӧс	пидзӧс-ӧд	sg	prl	FALSE	Tila	NA	NA	NA	NA	NA	(sairaat) eivät taivu polvesta	оз нюклясьны	NA	пидзӧсӧд	Первойсӧ висьысьыд норасьлӧ, суставъяс пӧ висьӧны, оз бура нюклясьны (ПИДЗӦСӦД, гырддзаӧд).
0573	ADP	выв	выв-ті	sg	tra	FALSE	Tila	NA	NA	NA	NA	NA	ei voi kulkea katon päältä	оз позь ветлыны	вевт	вывті	сёрӧм вылысь лым колӧ весавны усьӧм бӧрас пырысьтӧм-пыр жӧ; весалӧны мусяньыс кузь зіб йылӧ садитӧм зыртан пӧвйӧн; весавны кӧ ковмас сёрӧм вылӧ кайӧмӧн, сэк кок улӧ колӧ пуктыны пӧвйысь вӧчӧм либӧ палича пос, а сытӧг ветлыны вевт ВЫВТІ оз позь, мед вевтыс оз торксьы;
0574	ADP	кост	кост-ті	sg	tra	FALSE	Väylä	NA	NA	NA	NA	NA	ei voi kulkea lehmien välistä	оз позь ветлыны	мӧсъяс	костті	вывті векньыд стойлаын оз позь ветлыны мӧсъяс КОСТТІ, шуам, тшӧткаӧн весалігӧн; весавныс вывті колӧ не толькӧ гылалан гӧн идралӧм могысь, кодъяс лысьтысигӧн йӧв пиӧ веськалӧны да йӧвсӧ тшыкӧдӧны, но сідзжӧ кучик вылысь бус-няйт весалӧм вӧсна.
0575	ADP	берд	берд-ті-ыс	sg	tra	TRUE	Tila	NA	NA	NA	NA	NA	ei voi leikata juuren vierestä	оз позь вундынысӧ	вуж	бердтіыс	Коръяссӧ дзик вуж БЕРДТІЫС некыдзи оз позь вундынысӧ.
0576	NOUN	бӧрӧзда	бӧрӧзда-яс-ӧд	pl	tra	FALSE	Väylä (distr.)	NA	NA	NA	NA	NA	ei voi laskea menemään vakoja pitkin	оз позь лэдзны ветлыны	NA	бӧрӧздаясӧд	Оз позь вӧвтӧ лэдзны ветлыны картупель кустъяс кості БӦРӦЗДАЯСӦД, оз позь пыркӧдны картупель мусӧ зыр бердӧ, да с. в.
0577	ADP	кос	кос-ті	sg	prl	FALSE	NA	NA	NA	NA	NA	NA	ei voi laskea kulkemaan perunapuskien välistä	оз позь лэдзны ветлыны	картупель кустъяс	кості	Оз позь вӧвтӧ лэдзны ветлыны картупель кустъяс КОСТІ бӧрӧздаясӧд, оз позь пыркӧдны картупель мусӧ зыр бердӧ, да с. в.
0578	ADP	кост	кост-ті	sg	tra	FALSE	NA	NA	NA	NA	NA	NA	ei voi laskea lehmien välistä	оз позь лэдзыны	мӧсъяс	костті	Стойла либӧ мӧс оланін колӧ лоны буретш тӧрана, вывті мед абу жӧ ыджыд (сідзтӧ стрӧйбаыс дона лоӧ). вывті векньыд стойлаын оз позь ветлыны мӧсъяс КОСТТІ, шуам, тшӧткаӧн весалігӧн; весавныс вывті колӧ не толькӧ гылалан гӧн идралӧм могысь, кодъяс лысьтысигӧн йӧв пиӧ веськалӧны да йӧвсӧ тшыкӧдӧны, но сідзжӧ кучик вылысь бус-няйт весалӧм вӧсна.
0579	NOUN	места	места-ӧд-ыс	sg	prl	TRUE	Tila	NA	NA	NA	NA	NA	ettei (niistä) paikoista (kynsi) istuudu (osu?) hevosenkenkään	оз пуксьы	NA	местаӧдыс	Вӧлыслӧн кӧ гыжйыс потӧма кузяла ногыс, сэк сійӧ помыс вундыссьӧ гӧгыль джын модаӧн, медым сійӧ МЕСТАӦДЫС гыжйыс оз пуксьы подков вылас.
0580	ADP	пытш	пытш-ті-ыс	sg	tra	TRUE	NA	NA	NA	NA	NA	NA	eivät näy ihon läpi	оз тӧдчыны	кучик	пытштіыс	Посньыдик, небыдик нерӧдъясыд эськӧ быд мортлӧн эм да, дзоньвидза мортыдлӧн кучик ПЫТШТІЫС ки улад найӧ оз тӧдчыны.
0581	NOUN	туй	туй-ӧд	sg	prl	FALSE	NA	NA	NA	NA	NA	NA	ei mahdu vanhaa tietä	оз тӧр	NA	туйӧд	Шонтӧм вӧсна миян деньганым паськалӧма, важ ТУЙӦД оз нин тӧр.
0582	NOUN	розь	розь-ӧд-ыс	sg	prl	TRUE	NA	NA	NA	NA	NA	NA	ei putoa rei'istä	оз усь	NA	розьӧдыс	Катола сортировка кузьтаыс картупельыс гӧгыльтчӧ увлань, кытчӧдз оз усь РОЗЬӦДЫС улас.
0583	ADP	орд	орд-ӧд	sg	prl	FALSE	Kohdeväylä	NA	NA	NA	NA	NA	älä vie (sairaita) parantajien luo	он кыскав	бурдӧдчысьяс	ордӧд	Сьӧмын пӧраын кӧ босьтчан, нуан висьысьӧс больничаӧ, а он кыскав «тӧдысьяс», велӧдчытӧм бурдӧдчысьяс ОРДӦД, — верман.
0584	NOUN	зыртӧмин	зыртӧмин-ӧд-ыс	sg	prl	TRUE	NA	NA	NA	NA	NA	NA	auttavat pääsemään hieroutumapaikoista	отсалӧны пырны	NA	зыртӧминӧдыс	Пӧсьыс да няйтыс пуксьӧны дӧрӧм-гачас, зыртӧны яйсӧ, ЗЫРТӦМИНӦДЫС отсалӧны пырны висьӧдысь гагъяслы.
0585	NOUN	тшупӧд	тшупӧд-ъяс-ӧд	pl	prl	FALSE	Väylä	NA	NA	NA	NA	NA	tapaavat portaita (tasoja?) pitkin	паныдалӧ	NA	тшупӧдъясӧд	Татшӧм нога двуколкаа доддясянъясыс бурӧсь сійӧн, мый, первой-кӧ, ӧти чӧрсысла омӧльджыка паныдалӧ ТШУПӦДЪЯСӦД, мӧд-кӧ, джуджыд кӧльӧсаысла кокниджык кыскыны лёк туйясӧд, омӧльджыка вӧйӧны кӧльӧсаясыс няйтӧ да лыаӧ, коймӧд-кӧ, татшӧм телеганас кокниджык бергавны мӧд пӧлӧс телега дорысь, дай нёльӧд-кӧ, бурджыка вичмӧдӧ вӧвъяслысь вын.
0586	ADP	бок	бок-ӧд-ыс	sg	prl	TRUE	NA	NA	NA	NA	NA	NA	kulunut aika näkyy viivan reunasta	пасйыссьӧ	визь	бокӧдыс	Тайӧ нуӧдӧм визь БОКӦДЫС пасйыссьӧ кадыс, кодыр вӧлі аддзӧма тшынсӧ.
0587	ADP	выв	выв-ті	sg	tra	FALSE	NA	NA	NA	NA	NA	NA	merkitsee 15-20 cm savikerroksen päältä (?)	пасйысьӧ	15–20 см сёя слӧй	вывті	Медкокньыд вӧчны со кыдзи: пыдӧсыс пасйысьӧ булыжникӧн, изйӧн либӧ 15–20 см сёя слӧй ВЫВТІ.
0588	NOUN	пяталадор	пяталадор-ті-ыс	sg	tra	TRUE	NA	NA	NA	NA	NA	NA	leviää suonia pitkin	паськалӧ	NA	пяталадортіыс	Кык тӧлысь бӧрын кок гыжйыс ПЯТАЛАДОРТІЫС паськалӧ 1½–2 см пасьта, коді буретш тырмана сы вылӧ, медым вермис уджавны вӧлыс.
0589	NOUN	йыв	йыв-ті-ыс	sg	tra	TRUE	Väylä (mitta)	NA	NA	NA	NA	NA	leveys on päältä	пасьта	NA	йывтіыс	Му бердтіыс вышкалӧн площадь колӧ лоны 76,56 кв. метр пасьта, а ЙЫВТІЫС — 9,0 кв. метр пасьта.
0590	ADP	ув	ув-ті-ыс	sg	tra	TRUE	Väylä	NA	NA	NA	NA	NA	menee ulos aidan alitse	петас	забор	увтіыс	Порсьыд вермас курччавны скӧттӧ. Заборыд, потшӧсыд оз вермы кутны порсьтӧ, сійӧ гудъяс мусӧ да петас забор УВТІЫС.
0591	NOUN	розь	розь-ӧд	sg	prl	FALSE	Aukko	NA	NA	NA	NA	TRUE	reiästä ulos mennessä	петігӧн	NA	розьӧд	Куйӧд ва, РОЗЬӦД петігӧн, киссьӧ тайӧ пӧв вылӧ да паськыда сявгӧ му кузяыс.
0592	NOUN	горш	горш-ӧд	sg	prl	FALSE	Aukko	NA	NA	NA	NA	NA	tulee ulos kurkusta	петны	NA	горшӧд	Сэки нин, инӧ, висьӧмыд ёна мунӧ, гырдыд вермас тшӧтш ГОРШӦД петны, ӧтпырйӧ зэв уна.
0593	ADP	бок	бок-ъяс-ті	pl	tra	FALSE	Väylä	NA	NA	NA	NA	NA	menee ulos kanaalin reunoja pitkin	петӧ	канал	бокъясті	Кизьӧрмӧм-сылӧм сёян сёян сылан канал БОКЪЯСТІ петӧ вирӧ, мунӧ туша кузя.
0594	NOUN	вожаланін	вожаланін-ӧд	sg	prl	FALSE	Aukko	NA	NA	NA	NA	NA	(lapsi) tulee (ulos) haaravälistä	петӧ	NA	вожаланінӧд	Кагаыд чужигас петӧ ВОЖАЛАНІНӦД.
0595	NOUN	вожаланін	вожаланін-ӧд	sg	prl	FALSE	Aukko	NA	NA	NA	NA	NA	(verta) tulee ulos haaravälistä	петӧ	NA	вожаланінӧд	Маткаӧ сійӧ кадӧ чукӧрмӧ зэв уна вир, матка пытшкӧс польтчӧ, мыйкӧ мында вир (чашка джын мында став вир мунан лунъясас) петӧ ВОЖАЛАНІНӦД ортсӧ.
0596	NOUN	ин	ин-ті	sg	tra	FALSE	Tila (?)	NA	NA	NA	NA	NA	tulee ulos kuoren irtoamispaikasta	петӧ	NA	кырсь орӧм инті	Мукӧд местаясын, кӧні эм унджык пожӧма вӧр, пожӧм вывсьыс кырсьсӧ вӧсньыдика кульыштӧны да КЫРСЬ ОРӦМ ИНТІ петӧ сук сир.
0597	NOUN	колас	колас-ӧд	sg	prl	FALSE	Aukko	NA	NA	NA	NA	NA	tulee ulos välistä	петӧ	NA	коласӧд	Парыс вӧлі петӧ быд КОЛАСӦД.
0598	NOUN	колас	колас-ъяс-ӧд-ыс	pl	prl	TRUE	Aukko (distr.)	NA	NA	NA	NA	NA	tulee ulos väleistä	петӧ	NA	коласъясӧдыс	КОЛАСЪЯСӦДЫС петӧ.
0599	NOUN	розь	розь-яс-ӧд	pl	prl	FALSE	Aukko (distr.)	NA	NA	NA	NA	NA	kaasu menee ulos rei'istä	петӧ	NA	розьясӧд	Кольк кыш РОЗЬЯСӦД петӧ газ, коді ковтӧм сэн рӧдитчӧм курӧгпиянлы.
0600	NOUN	труба	труба-ӧд-ыс	sg	prl	TRUE	Väylä	NA	NA	NA	NA	NA	menee ulos putkea pitkin	петӧ	NA	трубаӧдыс	Бур сетан удж парӧвӧй машиналӧн став бырӧдӧм вынсьыс лоӧ 12%, а 88%-ыс вошӧ — «петӧ ТРУБАӦДЫС» да мунӧ аспытшса сопротивленньӧ бырӧдӧм вылӧ.
0601	NOUN	туй	туй-яс-ӧд	pl	prl	FALSE	Aukko (distr.)	NA	NA	NA	NA	NA	tulee ulos muunlaisia teitä pitkin	петӧ	NA	мукӧд сикас туйясӧд	Ва пырӧ пемӧс тушаӧ быдлаӧ, бӧрлань сэсянь петӧ ньылӧмӧн, кудзӧн, синваӧн, лолалӧмӧн дай МУКӦД СИКАС ТУЙЯСӦД и.
0602	NOUN	вом	вом-ӧд-ыс	sg	prl	TRUE	Aukko	NA	NA	NA	NA	NA	tulevat ulos suusta	петӧны	NA	вомӧдыс	Челядь сювйысь найӧ сітӧн жӧ петӧны, а овлӧ и ВОМӦДЫС.
0603	ADP	выв	выв-ті	sg	tra	FALSE	Tila	NA	NA	NA	NA	NA	ui merta pitkin	плавайтӧ	море	вывті	Важ грекъяс думайтлӧмаӧсь: Муыс пӧ зэв ыджыд блин кодь, плавайтӧ море ВЫВТІ.
0604	ADP	выв	выв-ті	sg	tra	FALSE	Tila	NA	NA	NA	NA	NA	ui merta pitkin	плавайтӧ	море	вывті	Став важ висьтъяс серти миянлысь Мутӧ кутшӧмкӧ паськыд море кутӧ: слӧнъясӧс кутысь черепаха пӧ море ВЫВТІ плавайтӧ, кит море вывті плавайтӧ.
0605	ADP	выв	выв-ті	sg	tra	FALSE	Tila	NA	NA	NA	NA	TRUE	meren yli uiva	плавайтысь	море	вывті	На ногӧн: Муыд зэв ыджыд гӧгыль джын кодь щит, мыджсьӧ 4 гырысь слӧн вылӧ, а слӧнъясыс сулалӧны «мирӧвӧй» море ВЫВТІ плавайтысь черепаха вылын.
0606	ADP	пытшк	пытшк-ӧд	sg	prl	FALSE	Tila	NA	NA	NA	NA	NA	voi taistella (?) maan lävitse (monella tavalla)	позьӧ вермасьны	NA	му пытшкӧд	Вермасьны МУ ПЫТШКӦД позьӧ уна ногӧн.
0607	NOUN	бӧрӧзда	бӧрӧзда-ӧд-ыс	sg	prl	TRUE	Väylä	NA	NA	NA	NA	NA	voi kulkea vakoa pitkin	позьӧ ветлӧдлыны	NA	бӧрӧздаӧдыс	Радъяс костсӧ колӧ гожӧмбыдӧн небзьӧдны кыкысь-куимысь, кытчӧдз позьӧ БӦРӦЗДАӦДЫС ветлӧдлыны коръяссӧ жугӧдлытӧг.
0608	NOUN	ю	ю-яс-ӧд	pl	prl	FALSE	Väylä (distr.)	NA	NA	NA	NA	NA	voi mennä jokia pitkin	позьӧ ветлыны	NA	юясӧд	Сійӧ вӧлі висьтавлӧ: «Босьтам кӧ, миян тӧвся пӧра позьӧ ветлыны доддьӧн, а гожӧмын позьӧ ветлыны ЮЯСӦД.
0609	NOUN	ин	ин-ті	sg	tra	FALSE	Tila	NA	NA	NA	NA	NA	voi lannoittaa hiekan päältä	позьӧ вынсьӧдны	NA	лыаа инті	Калийнӧй солӧн позьӧ вынсьӧдны кӧть кутшӧм му: ЛЫАА ИНТІ, кӧть сёя инті.
0610	NOUN	ин	ин-ті	sg	tra	FALSE	Tila	NA	NA	NA	NA	NA	voi lannoittaa savimaan päältä	позьӧ вынсьӧдны	NA	сёя инті	Калийнӧй солӧн позьӧ вынсьӧдны кӧть кутшӧм му: лыаа инті, кӧть СЁЯ ИНТІ.
0611	ADV	сэ	сэ-ті	NA	tra	NA	NA	NA	NA	NA	NA	NA	NA	NA	NA	сэті	Абу кӧ гӧрӧма арнас коськӧм мутӧ, тулыснас колӧ СЭТІ гӧрны водзджык, пырысь-пыр, мыйӧн помасяс вося кӧдзаыд, сёрмӧдчан кӧ гӧрӧмнад, бара жӧ муыс вывті ёна косьмӧ да бӧрті гырысь комӧкӧн кутас гӧрсьыны.
0612	ADV	сэ	сэ-ті	NA	tra	NA	NA	NA	NA	NA	NA	NA	NA	NA	NA	сэті	Арктика кузя муннысӧ вывті сьӧкыд, ёна кыз йиа СЭТІ да, йиыс сэтысь весиг гожӧмъяснас оз сывлы да, нэмыс пыр сэні куйлӧ да.
0613	ADV	сэ	сэ-ті	NA	tra	NA	NA	NA	NA	NA	NA	NA	NA	NA	NA	сэті	Босьтам кутшӧмкӧ места: йӧзыс шуӧны сэн пӧ каститчӧ — ковмас СЭТІ полысьджык — нервнӧй мортлы мунны пемыдӧн.
0614	ADV	сэ	сэ-ті	NA	tra	NA	NA	NA	NA	NA	NA	NA	NA	NA	NA	сэті	Ветлӧдласны СЭТІ недыр да сэтчӧ и овмӧдчасны.
0615	ADV	сэ	сэ-ті	NA	tra	NA	NA	NA	NA	NA	NA	NA	NA	NA	NA	сэті	Вожъяс да коръяс быдман интіыс гӧрддзасьӧма, СЭТІ кызджык дай абу тӧщӧ.
0616	ADV	сэ	сэ-ті	NA	tra	NA	NA	NA	NA	NA	NA	NA	NA	NA	NA	сэті	Войясын сювйысь петӧ да визлалӧ сітан гӧгӧр, гильӧдӧ СЭТІ.
0617	ADV	сэ	сэ-ті	NA	tra	NA	NA	NA	NA	NA	NA	NA	NA	NA	NA	сэті	Гыжъясигӧн няйтыскӧд тшӧтш веськалӧны найӧ гыжна дойясӧ, пежалӧны СЭТІ.
0618	ADV	сэ	сэ-ті	NA	tra	NA	NA	NA	NA	NA	NA	NA	NA	NA	NA	сэті	Зырасьӧмысь кӧ кыткӧ пыктас, мӧдысь зырасигӧн СЭТІ оз ков зыравны, мед шойччас.
0619	ADV	сэ	сэ-ті	NA	tra	NA	NA	NA	NA	NA	NA	NA	NA	NA	NA	сэті	Кага весьтіыс везйыс потӧма, СЭТІ и петӧма вирыс.
0620	ADV	сэ	сэ-ті	NA	tra	NA	NA	NA	NA	NA	NA	NA	NA	NA	NA	сэті	Кага войын гыжъялӧ СЭТІ да садьмӧ, оз вермы узьны.
0621	ADV	сэ	сэ-ті	NA	tra	NA	NA	NA	NA	NA	NA	NA	NA	NA	NA	сэті	Кӧнкӧ му пытшкын эм сов, ва СЭТІ ветлӧдлӧ, ва пытшкӧ сов разалӧ, ваыскӧд сов кайӧ ортсӧ ключьясӧн.
0622	ADV	сэ	сэ-ті	NA	tra	NA	NA	NA	NA	NA	NA	NA	NA	NA	NA	сэті	Кытчӧ быдмӧ медкузя туруныд, СЭТІ потшыштны колӧ скӧт йирӧмысь торъя йӧрӧ.
0623	ADV	сэ	сэ-ті	NA	tra	NA	NA	NA	NA	NA	NA	NA	NA	NA	NA	сэті	Кытчӧ индӧма кодйыны силос гусӧ либӧ траншеясӧ, СЭТІ водзджык мерайтӧны.
0624	ADV	сэ	сэ-ті	NA	tra	NA	NA	NA	NA	NA	NA	NA	NA	NA	NA	сэті	Ми пыр сідзи бурдӧдчам: войдӧр дой вылас му пуктам, сэсся рузумӧн кӧрталам СЭТІ.
0625	ADV	сэ	сэ-ті	NA	tra	NA	NA	NA	NA	NA	NA	NA	NA	NA	NA	сэті	Мукӧд зурасьтӧдз небеснӧй изъяс войдӧр паныдасьӧны Му гӧгӧрса сынӧдкӧд — СЭТІ колӧ изъяслы вуджны.
0626	ADV	сэ	сэ-ті	NA	tra	NA	NA	NA	NA	NA	NA	NA	NA	NA	NA	сэті	Мукӧддырйиыс вирӧдз чарсъяс, сэсся лӧмалас СЭТІ.
0627	ADV	сэ	сэ-ті	NA	tra	NA	NA	NA	NA	NA	NA	NA	NA	NA	NA	сэті	Мусиныс картупельлы колӧ рӧшкыдджык, мед бурджыка вермис ветлыны СЭТІ сынӧд (воздук) да кокньыдджык сэні вӧлі быдмыны да паськавны картупельлы.
0628	ADV	сэ	сэ-ті	NA	tra	NA	NA	NA	NA	NA	NA	NA	NA	NA	NA	сэті	Муыс кӧ лыакодь (супесчанӧй), сынӧдыс бура СЭТІ ветлӧ да куйӧдалӧма кӧ куйӧдӧн, сэки позьӧ турнепс кӧдзны шыльыдінӧ радъясӧн, 45–50 см костӧн радысь радӧ.
0629	ADV	сэ	сэ-ті	NA	tra	NA	NA	NA	NA	NA	NA	NA	NA	NA	NA	сэті	Нӧшта нин ёна лудӧ, жельнӧг кодь сутшкасяннас дойдалӧ кучиктӧ да, веськалӧм ядсьыс зӧлитӧ СЭТІ да.
0630	ADV	сэ	сэ-ті	NA	tra	NA	NA	NA	NA	NA	NA	NA	NA	NA	NA	сэті	Няйтчӧмыдла СЭТІ висьмӧма.
0631	ADV	сэ	сэ-ті	NA	tra	NA	NA	NA	NA	NA	NA	NA	NA	NA	NA	сэті	Пелькӧдны колӧ СЭТІ пыр, чышкыны да весавны куйӧдысь да ёгысь.
0632	ADV	сэ	сэ-ті	NA	tra	NA	NA	NA	NA	NA	NA	NA	NA	NA	NA	сэті	Пуын эмӧсь сэтшӧм жӧ сӧнъяс, СЭТІ визувтӧ сира пу сӧк.
0633	ADV	сэ	сэ-ті	NA	tra	NA	NA	NA	NA	NA	NA	NA	NA	NA	NA	сэті	Пывсянад пыран да, кӧні кӧсъян мыссьыны, зэв ёна пуан ванас киськав СЭТІ, мед, эмӧсь кӧ сэні гагъяс, ставныс заваритчасны.
0634	ADV	сэ	сэ-ті	NA	tra	NA	NA	NA	NA	NA	NA	NA	NA	NA	NA	сэті	Пыкӧсыс кӧ быдмас вом пытшкӧсӧ, недыр мысти СЭТІ воссяс, вомыс ӧтлаасяс ныркӧд.
0635	ADV	сэ	сэ-ті	NA	tra	NA	NA	NA	NA	NA	NA	NA	NA	NA	NA	сэті	Ревматизмӧн висьмӧм суставлӧн мешӧк кодь кучик пытшкыс ӧдӧ (воспаляйтчӧ) да пыктӧ, эж вылас лоӧны аслыссяма зэв посньыдик пятнаяс, чутъяс, СЭТІ неуна вир петлывлӧ.
0636	ADV	сэ	сэ-ті	NA	tra	NA	NA	NA	NA	NA	NA	NA	NA	NA	NA	сэті	Санаторийысь бӧр больнича керка дінті мунігӧн нуисны СЭТІ волшебнӧй пӧнар.
0637	ADV	сэ	сэ-ті	NA	tra	NA	NA	NA	NA	NA	NA	NA	NA	NA	NA	сэті	сідз кӧ, Мулы колӧ зэв ӧдйӧ котӧртны СЭТІ.
0638	ADV	сэ	сэ-ті	NA	tra	NA	NA	NA	NA	NA	NA	NA	NA	NA	NA	сэті	Сійӧ кӧ кӧласяс (кутчысяс) киад, а киад эмӧсь дойяс, гыжнаяс, — СЭТІ бактерияыс пырас вирӧ.
0639	ADV	сэ	сэ-ті	NA	tra	NA	NA	NA	NA	NA	NA	NA	NA	NA	NA	сэті	Сійӧ пондас писькӧдчыны ортсӧ, восьтас аслыс туй дай пондас СЭТІ виявны.
0640	ADV	сэ	сэ-ті	NA	tra	NA	NA	NA	NA	NA	NA	NA	NA	NA	NA	сэті	Сэн мед вӧлі бура тӧдчӧны йӧв сӧнъясыс, — СЭТІ вир сӧнъяссяньыс локтӧны сэтшӧм коланторъяс, мыйысь артмӧ йӧлыс.
0641	ADV	сэ	сэ-ті	NA	tra	NA	NA	NA	NA	NA	NA	NA	NA	NA	NA	сэті	Сэсся ӧд СЭТІ жӧ пондас визувтны куйӧд ваыс.
0642	ADV	сэ	сэ-ті	NA	tra	NA	NA	NA	NA	NA	NA	NA	NA	NA	NA	сэті	Сэсся, аддзысясны кӧ ӧпаснӧй местаяс, весавны СЭТІ му грунтӧдзыс 0,5–1 метр пасьта разрывнӧй полосаяс.
0643	ADV	сэ	сэ-ті	NA	tra	NA	NA	NA	NA	NA	NA	NA	NA	NA	NA	сэті	СЭТІ нывъяслӧн петӧ тӧлысся вирыс.
0644	ADV	сэ	сэ-ті	NA	tra	NA	NA	NA	NA	NA	NA	NA	NA	NA	NA	сэті	СЭТІ позьӧ кайны вевдорӧдзыс.
0645	ADV	сэ	сэ-ті	NA	tra	NA	NA	NA	NA	NA	NA	NA	NA	NA	NA	сэті	СЭТІ пӧшти ставнас сынӧдтӧм интас.
0646	ADV	сэ	сэ-ті	NA	tra	NA	NA	NA	NA	NA	NA	NA	NA	NA	NA	сэті	СЭТІ пырӧма пон дай 2 тупӧсь нянь сёйӧма.
0647	ADV	сэ	сэ-ті	NA	tra	NA	NA	NA	NA	NA	NA	NA	NA	NA	NA	сэті	СЭТІ уялісны-ворсісны челядь, кватлалісны чакотка гагъяссӧ аслыныс.
0648	ADV	сэ	сэ-ті	NA	tra	NA	NA	NA	NA	NA	NA	NA	NA	NA	NA	сэті	Тайӧ ӧдзӧсӧдыс курӧгпиян вермӧны пыравны узьланінас да лунын шонтысьӧм могысь, СЭТІ пыр шоныд.
0649	ADV	сэ	сэ-ті	NA	tra	NA	NA	NA	NA	NA	NA	NA	NA	NA	NA	сэті	тӧдліс, мый вӧсна овлӧ луныд да войыд — муыд бергалігас ӧти баннас видзӧдӧ шонділань, сэки сэні — лун, мӧдар банас шондіыслӧн югӧръясыс оз инмыны да СЭТІ пемыд — вой.
0650	ADV	сэ	сэ-ті	NA	tra	NA	NA	NA	NA	NA	NA	NA	NA	NA	NA	сэті	Торъя нин сӧстӧма да коса колӧ видзны кок вож кост кучиксӧ, медым СЭТІ эз шузьы да эз воссьы.
0651	ADV	сэ	сэ-ті	NA	tra	NA	NA	NA	NA	NA	NA	NA	NA	NA	NA	сэті	Унаысь кужтӧг аборттӧ вӧчигӧн маткаас кольышталӧ яй торъяс, — оз мичаа весассьы СЭТІ, либӧ вӧчӧны абортсӧ няйт струментъясӧн.
0652	ADV	сэ	сэ-ті	NA	tra	NA	NA	NA	NA	NA	NA	NA	NA	NA	NA	сэті	Чахотка гаг кытчӧ овмӧдчас, СЭТІ и висьмӧдас.
0653	ADV	сэр	сэр-ті	NA	tra	NA	NA	NA	NA	NA	NA	NA	NA	NA	NA	сэрті	Сэні эм тырыс пӧтӧса торъяс, кодъяс вӧв организм пытшкын сылӧны да разалӧны бурджыка мукӧд пемӧсъяс организмын СЭРТІ.
