identifier	pos	stem	morphology	number	case	psx	comment	figurative	grabbing	temporal	existential	non-finite	meaning_fin	predicate	rel_nouns_noun?	form	sentence
0001	NOUN	коласт	коласт-ъяс-ӧд	pl	prl	FALSE	NA	NA	NA	NA	NA	NA	NA	_	NA	коластъясӧд	Тайӧ пӧжарыс зэв ёна действуйтӧ жар дырйи, лунын, а войын мукӧдлатіыс (торъя нин шоч вӧраинті да куш КОЛАСТЪЯСӦД), лысва усьӧм понда да посни мусин вылыс понда, ачыс кусӧ.
0002	ADP	кос	кос-ті	sg	tra	FALSE	NA	NA	NA	NA	NA	NA	NA	_	сэк	кості	Вочасӧн, сэк КОСТІ, куктӧ колӧ велӧдны мукӧд сёянӧ (зӧр пызя юанӧ, абу кӧ сійӧ — ид пызьӧ, позьӧ жмыкӧ, турунӧ, нянь крӧшкиӧ).
0003	ADP	кос	кос-ті	sg	tra	FALSE	NA	NA	NA	NA	NA	NA	NA	_	сэк	кості	Мыськалӧм картупель тупыльтӧ кольӧй 4—5 лун кежӧ шонді водзӧ — тіян картупель тупыльныд сэк КОСТІ вежсяс.
0004	NOUN	шӧр	шӧр-ӧд-ыс	sg	prl	TRUE	NA	NA	NA	NA	TRUE	NA	"""leveys keskeltä"""	_	NA	шӧрӧдыс	Кормӧвӧй проходыс стен пӧлӧн 120 см пасьта ШӦРӦДЫС (кык кормушка костын) 150 см.
0005	ADP	шӧр	шӧр-ті-ыс	sg	tra	TRUE	NA	NA	NA	NA	TRUE	NA	"""pituus keskeltä"""	_	му	шӧртіыс	— Му кытшлысь кузьта верст лыдсӧ кӧ тӧдан, сэки му шӧртас кузьтасӧ (дзик му ШӦРТІЫС, рочӧн шуӧны диаметрӧн) кокни корсьны: колӧ сӧмын му кытш кузьтасӧ юкны 3 да ӧти сизимӧд (1/7) вылӧ.
0006	NOUN	весьт	весьт-ӧд-ыс	sg	prl	TRUE	NA	NA	NA	NA	TRUE	NA	yltä olkiseinät ovat paksumpia (?)	?	NA	весьтӧдыс	Идзас пытшкыс тыртӧм, гоз-мӧдлаын эмӧсь вежӧсъяс, ВЕСЬТӦДЫС идзасыс вежӧсъяс кызджык — йӧзви.
0007	NOUN	лы	лы-ті-ыс	sg	tra	TRUE	NA	NA	NA	NA	NA	NA	NA	?	NA	лытіыс	Пуктан кӧ рушку вомӧныс курӧглы китӧ, юрсяньыс морӧс ЛЫТІЫС да колькъялан лы костъясас бура колькъялан курӧглы бердӧ став ки пыдӧсыд.
0008	NOUN	места	места-ті-ыс	sg	tra	TRUE	NA	NA	NA	NA	NA	NA	NA	?	NA	местатіыс	Сы бӧрын сійӧ жӧ лентаӧн мерайтсьӧ кызта — лентасӧ нуӧдӧны морӧс гӧгӧрыс, шоша шӧр весьттіыс — пӧдпруга МЕСТАТІЫС, водз кок гырддзасьыс 10 сантиметр либӧ ки вомлӧс, бӧрлань.
0009	NOUN	туй	туй-ӧд	sg	prl	FALSE	NA	TRUE	NA	NA	NA	NA	sen luonteinen CHECK	?	NA	туйӧд	Финскӧй скӧтыд, код рӧдысь-вужйысь паськалі и миян скӧтным, кыдзи сійӧ висьталӧма вылынджык, шань и сы ТУЙӦД, мый сетӧ бур нӧк-вый, сук йӧв, уна % гос (жир).
0010	NOUN	туй	туй-ӧд	sg	prl	FALSE	NA	NA	NA	NA	NA	NA	NA	?	NA	туйӧд	Мӧд ТУЙӦД — тайӧ беддяс медводзысь волі вӧчӧма ёсь крук, сэсся та бӧрын вӧчисны кокан, гӧр да медбӧрысь воисны плугйӧдз.
0011	NOUN	туй	туй-ӧд	sg	prl	FALSE	NA	NA	NA	NA	NA	NA	NA	?	NA	туйӧд	Ӧти ТУЙӦД — ёсьтӧм беддьыс быдмис из пома беддьӧ, ичӧтик зыр кодьӧ.
0012	NOUN	пытшкӧс	пытшкӧс-ӧд-ыс	sg	prl	TRUE	Kohdeväylä	NA	NA	NA	NA	NA	lanka on vedetty sisuksista	(сунис) нуӧдӧма	NA	пытшкӧсӧдыс	Видзӧдлан кӧ микроскоп пыр татшӧм сьӧдасьны пондӧм картупель корсӧ, аддзан, мый картупель кор ПЫТШКӦСӦДЫС быттьӧ сунис нуӧдӧма, чукӧрмӧмаӧсь тшакъясыд.
0013	NOUN?	дор	дор-ӧд	sg	prl	FALSE	NA	NA	NA	NA	NA	NA	NA	x	NA	дорӧд	Сёрӧмлӧн кӧ судтаыс 2,8 метрысь джуджыдджык оз ло, зэв удобнӧ вевттьыны ӧти брезентӧн, кодлӧн пасьтаыс вермас видзны зэрысь (сёрӧм вылысь ДОРӦД кӧ ӧшӧдчас на 15–20 см кымын).
0014	NOUN?	дорыш	дорыш-ті-ыс	sg	tra	TRUE	NA	NA	NA	NA	NA	NA	NA	x	NA	дорыштіыс	Сы бӧрын вӧсньыдика ёсьтӧм карандашӧн алидада емладорса ДОРЫШТІЫС, нуӧдӧны веськыд визь, коді пӧперегалӧ юклӧм дача план рамкасӧ, кыдзи петкӧдлӧма схематическӧй чертёж вылын.
0015	ADP	кост	кост-ӧд	sg	prl	FALSE	Aukko	NA	NA	NA	NA	NA	puun oksien välistä (hän) näki	аддзис	пу увъяс	костӧд	И сэн, на сайын, пу увъяс КОСТӦД сійӧ аддзис: сё, кыксё, витсё, он гӧгӧрво мындаӧн белӧйяс мыйвынсьыныс локтӧны станциялань.
0016	ADP	выв	выв-ті	sg	tra	FALSE	NA	NA	NA	NA	NA	NA	hyrrä pyörii maata pitkin	бергалыштас	Му	вывті	Кор дурпоп медъёна бергалӧ, бергалыштас неуна джоджӧд либӧ Му ВЫВТІ дай сувтӧ ёсь вылас ӧтилаӧ, быттьӧ измылӧ, муртса тӧдчыштӧ бергӧдчӧмыс.
0017	NOUN	джодж	джодж-ӧд	sg	prl	FALSE	NA	NA	NA	NA	NA	NA	kääntyy lattiaa pitkin	бергалыштас	NA	джоджӧд	Кор дурпоп медъёна бергалӧ, бергалыштас неуна ДЖОДЖӦД либӧ Му вывті дай сувтӧ ёсь вылас ӧтилаӧ, быттьӧ измылӧ, муртса тӧдчыштӧ бергӧдчӧмыс.
0018	ADP	весь	весь-ті	sg	tra	FALSE	Tila	NA	NA	NA	NA	NA	"käännän ""kuuta"" auringon ja maan (mallin) ylitse"	бергӧдла	шондиа-муа	весьті	Ме бергӧдла «тӧлысьсӧ» «му» гӧгӧр ог дзик шондіа-муа ВЕСЬТІ.
0019	NOUN	туй	туй-ӧд	sg	prl	FALSE	Väylä	TRUE (?)	NA	NA	NA	NA	kääntyy (omaa) tietään (muualle)	бергӧдчӧ	NA	туйӧд	Сӧмын тӧлысьыс аслас ТУЙӦД мӧдарӧ бергӧдчӧ да кольччӧ енэжсьыс.
0020	NOUN	овмӧдчанін	овмӧдчанін-ті	sg	tra	FALSE	Tila	NA	NA	NA	NA	NA	(niiden) pesimispaikka polttelee	биалӧ	NA	овмӧдчанінті	Найӧ ОВМӦДЧАНІНТІ биалӧ, гӧрдӧдӧ, сэсся вежӧдӧ — орӧссьӧ.
0021	NOUN	кӧвй	кӧвй-ӧд-ыс	sg	prl	TRUE	NA	NA	TRUE	NA	NA	NA	ota (pallo) narusta	босьт	NA	кӧвйӧдыс	— Ӧні босьт сярсӧ КӦВЙӦДЫС, — тшӧктіс профессор, — сувт чужӧмнад лампаланьыс да кут сярсӧ сідз, мед сійӧ вӧлі синма-лампаа костас.
0022	ADP	берд	берд-ті	sg	tra	FALSE	Väylä	NA	NA	NA	NA	NA	kulkee sontakanavaa pitkin	босьтсьӧ	куйӧд канава	бердті	Кыскан трубаыс ӧні вӧчсьӧ кык пӧвстӧн: шоныд сынӧд (ру) босьтсьӧ (кыскыссьӧ) вылысь, йирк бердысь, стойласа газъяс (медъёна — аммиак) улысь, куйӧд канава БЕРДТІ.
0023	ADP	туй	туй-ӧд	sg	prl	FALSE	NA	TRUE	NA	NA	NA	NA	kasvoi tällä tavalla CHECK	быдмис	NA	туйӧд	Тайӧ ТУЙӦД и быдмис 3 сюрс во чӧж первобытнӧй гӧр — рогулька.
0024	NOUN	кос	кос-ті	sg	tra	FALSE	NA	TRUE	NA	NA	NA	NA	vetävät väliin (saada keskenmeno)	вайӧны	NA	кості	Йӧз дзоньвидзалун вӧсна тӧждысьысь комиссариат бердса венерологическӧй диспансер * арталӧм серти миян лёквисьӧмӧн висьысь мамъяслӧн 55% кага вайӧм оз лючкиа помась (либӧ кулӧмаӧсь, либӧ КОСТІ вайӧны).
0025	ADP	выв	выв-ті-ыд	sg	tra	TRUE	Tila	NA	NA	NA	NA	NA	vetää pään päältä	ваяс	юр	вывтіыд	Кужӧмӧн мутӧ вынсьӧдан, кужӧмӧн уджалан, дӧзьӧритан, — муыд юр ВЫВТІЫД ваяс тэд турун и нянь.
0026	NOUN	кост	кост-ті	sg	tra	FALSE	NA	TRUE	NA	NA	NA	NA	vetää väliin (saada keskenmeno)	ваяс	NA	костті	Ёгор гӧтыр челядясяс, КОСТТІ ваяс кага.
0027	ADP	дін	дін-ті-ыс	sg	tra	TRUE	Tila	NA	NA	NA	NA	NA	peittää ruohon juuren kohdalta	вевттӧ	турун_под	дінтіыс	Ойдлан видзьястӧ вынсьӧдӧ-куйӧдалӧ тувсов ваыс; сійӧ аслас визулӧн вайыштӧ ыджыд ва дырйи, ваӧн босьтӧм инъясысь жӧ, бурджык му да вевттьӧ важ мусинсӧ турун под ДІНТІЫС (шуӧны тай: видзтӧ пӧ няйталӧ).
0028	ADP	кос	кос-ті	sg	tra	FALSE	Väylä	NA	NA	NA	NA	NA	(ruoho) ehtii kasvaa sen välistä	вевъялас быдмыны	сы	кості	Сы КОСТІ мӧдлаас туруныс вевъялас быдмыны; сійӧ жӧ тӧдас, кутшӧм кадӧ колӧ скӧтсӧ видзны бур пӧскӧтина вылын да кутшӧм кадӧ омӧльджык вылын; скӧтъяс кӧ висьмасны, вермас сетны медводдза отсӧг висьысь скӧтъяслы.
0029	ADP	выв	выв-ті	sg	tra	FALSE	Tila	NA	NA	NA	NA	NA	siirsivät (kuorman) maan yli	вежисны	му	вывті	Техникалӧн, промышленносьтлӧн да вузасьӧмлӧн паськалӧмыс ӧти сё воӧн дзикӧдз вежисны му ВЫВТІ да ва вывті груз да йӧзӧс кыскалан ногсӧ.
0030	ADV	выв	выв-ті	NA	tra	NA	NA	NA	NA	NA	NA	NA	heinä on kasvanut liian kauan	NA	NA	вывті	Унджык шептыс кӧ кӧйдыса либӧ эмӧсь кӧйдыс быдманінъясыс (шеплӧн шульясыс) — турун ВЫВТІ дыр быдмӧма (сӧрмӧма).
0031	ADP	выв	выв-ті	sg	tra	FALSE	Tila	NA	NA	NA	NA	NA	siirsivät (kuorman) veden yli	вежисны	ва	вывті	Техникалӧн, промышленносьтлӧн да вузасьӧмлӧн паськалӧмыс ӧти сё воӧн дзикӧдз вежисны му вывті да ва ВЫВТІ груз да йӧзӧс кыскалан ногсӧ.
0032	NOUN	веськаланін	веськаланін-ті	sg	tra	FALSE	Aukko	NA	NA	NA	NA	NA	vihertää ötökän sisäänmenoaukosta	вежӧдас	NA	гаг веськаланінті	Войдӧр ГАГ ВЕСЬКАЛАНІНТІ вежӧдас, сэсся висьны, ёнтыны пондас.
0033	NOUN	мунан_туй	мунан_туй-ӧд-ыс	sg	prl	TRUE	Väylä	NA	NA	NA	NA	TRUE	kaventaen pienentää menoreittiä	векньӧдӧмӧн чинтыны	NA	мунан_туйӧдыс	Сэні колӧ кутны бисӧ водзӧ мунӧмысь да пӧжарсӧ вочасӧн векньӧдӧмӧн чинтыны билысь вынсӧ главнӧй МУНАН ТУЙӦДЫС.
0034	ADP	ув	ув-ті-ыс	sg	tra	TRUE	Tila	NA	NA	NA	NA	NA	oppi ylittämään veden alitse	велаліс вуджны	ва	увтіыс	Ӧні сійӧ ёна вежӧра лои, вермӧ лэбавны пӧткаяс дорысь сюсьджыка да дырджыка, велаліс саридзьяс вомӧн, ва УВТІЫС вуджны, мӧда-мӧдкӧд сюрс верст сайсянь сёрнитны телепонӧн, тӧдӧ кодзувъяслысь туйсӧ, весиг во-мӧд водзвыв вермӧ висьтавны шонді саявлӧм йылысь.
0035	ADP	туй	туй-ӧд	sg	prl	FALSE	Aukko	NA	NA	NA	NA	NA	voi siirtyä haavan kautta	вермас вуджны	гыжна	туйӧд	Висьӧмыд вермас вуджны и гыжна ТУЙӦД да дой пыр.
0036	ADP	выв	выв-ті	sg	tra	FALSE	Tila	NA	NA	NA	NA	NA	voi paeta katon kautta	вермас петны	вевт	вывті	А оз кӧ ло турунсӧ бура йӧткыштӧма, сійӧ вермас бӧр петны ползун вевт ВЫВТІ, дзугсьыны камера вевта – ползун юра костын да тыртны машинасӧ.
0037	NOUN	места	места-ӧд	sg	prl	FALSE	Väylä	NA	NA	NA	NA	NA	voi tunkeutua (jotain) reittiä	вермас писькӧдчыны	NA	местаӧд	Он кӧ тадзи вӧч, биыс зэв кокньыда да тӧдлытӧг вермас кутшӧмкӧ МЕСТАӦД писькӧдчыны чеп пыр да ӧзйыны рабочӧйяс мыш сайын.
0038	ADV	бӧр	бӧр-ті	NA	tra	NA	NA	NA	NA	NA	NA	NA	takaa	NA	NA	бӧрті	Абу кӧ гӧрӧма арнас коськӧм мутӧ, тулыснас колӧ сэті гӧрны водзджык, пырысь-пыр, мыйӧн помасяс вося кӧдзаыд, сёрмӧдчан кӧ гӧрӧмнад, бара жӧ муыс вывті ёна косьмӧ да БӦРТІ гырысь комӧкӧн кутас гӧрсьыны.
0039	ADV	бӧрладор	бӧрладор-ті-ыс	NA	tra	NA	NA	NA	NA	NA	NA	NA	NA	NA	NA	бӧрладортіыс	Бура колькъялысь курӧглӧн бокса лыясыс БӦРЛАДОРТІЫС вӧсньыдикӧсь, небыдӧсь, лайкъялана (личкыштан да).
0040	NOUN	места	места-ӧд-ыс	sg	prl	TRUE	Väylä (2-ulott.)	NA	NA	NA	NA	NA	(lautta) saattoi mennä	вермис мунны	NA	местаӧдыс	Тайӧ МЕСТАӦДЫС паракод вермис мунны 3 час да 10 минутӧн.
0041	NOUN	дой	дой-ӧд	sg	prl	FALSE	Aukko	NA	NA	NA	NA	NA	voi kulkeutua (silmin näkymättömästä) haavasta	вермӧ веськавны	NA	дойӧд	Вермӧ веськавны весиг синмӧн аддзытӧм ДОЙӦД.
0042	NOUN	ва	ва-ӧд	sg	prl	FALSE	Väylä (2-ulott.)	NA	NA	NA	NA	NA	voi kulkea vettä pitkin	вермӧ ветлыны	NA	ваӧд	Машинаясӧн морт вермӧ ветлыны кос вывті, ВАӦД, уна сё пӧв ӧдйӧнджыка да кокньыдджыка.
0043	ADV	быдла	быдла-ті	NA	tra	NA	NA	NA	NA	NA	NA	NA	kaikkialta	NA	NA	быдлаті	БЫДЛАТІ ойдӧма — ваӧн тырӧма.
0044	ADV	быдла	быдла-ті	NA	tra	NA	NA	NA	NA	NA	NA	NA	kaikkialta	NA	NA	быдлаті	Вина юысь морт эновтчӧ овмӧссьыс, омӧля уджалӧ, БЫДЛАТІ киссьӧма, жугласьӧма, некыт оз выльдышт.
0045	ADV	быдла	быдла-ті	NA	tra	NA	NA	NA	NA	NA	NA	NA	kaikkialta	NA	NA	быдлаті	Голясӧ, киняувъяссӧ, пель сайяссӧ, кокъяс костсӧ — БЫДЛАТІ, кыті кусыня кучикыс — косьтыны сӧмын личкыштӧмӧн: небыдика тап-тап вӧчышт.
0046	ADV	быдла	быдла-ті	NA	tra	NA	NA	NA	NA	NA	NA	NA	kaikkialta	NA	NA	быдлаті	Гутъясыд БЫДЛАТІ лэбалӧны, гожӧмъясын керка картаыд наӧн тыр.
0047	ADV	быдла	быдла-ті	NA	tra	NA	NA	NA	NA	NA	NA	NA	kaikkialta	NA	NA	быдлаті	Дзоньвидза-ӧ БЫДЛАТІ кагаыс, позьӧ тӧдны веситӧм серти.
0048	ADV	быдла	быдла-ті	NA	tra	NA	NA	NA	NA	NA	NA	NA	kaikkialta	NA	NA	быдлаті	Кага видзигӧн мед вӧлі БЫДЛАТІ сӧстӧм.
0049	ADV	быдла	быдла-ті	NA	tra	NA	NA	NA	NA	NA	NA	NA	kaikkialta	NA	NA	быдлаті	Казяланныд кӧ нырсьыс ва петӧм, пыкӧсъяс кучик вывсьыс, асмогасянінъяссьыс висьӧмъяс, абу кӧ БЫДЛАТІ лючки-ладнӧ, пырысьтӧм-пыр жӧ колӧ петкӧдлыны вӧвтӧ скӧт лекарлы.
0050	ADV	быдла	быдла-ті	NA	tra	NA	NA	NA	NA	NA	NA	NA	kaikkialta	NA	NA	быдлаті	Киноыд БЫДЛАТІ новлӧдлас, быдсяма олӧмсӧ петкӧдлас син водзад, ас сиктсьыд некытчӧ ветлытӧг.
0051	ADV	быдла	быдла-ті	NA	tra	NA	NA	NA	NA	NA	NA	NA	kaikkialta	NA	NA	быдлаті	Колӧ став керкатӧ киськавны пузьӧм ваӧн, резны БЫДЛАТІ.
0052	ADV	быдла	быдла-ті	NA	tra	NA	NA	NA	NA	NA	NA	NA	kaikkialta	NA	NA	быдлаті	Кӧртӧднад зэлӧдӧ сійӧс БЫДЛАТІ, оз вермы лючки лолыштны ни быдмыны, быттьӧ поньталӧма.
0053	ADV	быдла	быдла-ті	NA	tra	NA	NA	NA	NA	NA	NA	NA	kaikkialta	NA	NA	быдлаті	Лыяс висьмӧм бӧрын мортыдлы зэв нин сьӧкыд да делӧ овны: БЫДЛАТІ зэв ёна юкалӧ, медся нин войясын.
0054	ADV	быдла	быдла-ті	NA	tra	NA	NA	NA	NA	NA	NA	NA	kaikkialta	NA	NA	быдлаті	Миян ӧд сӧмын БЫДЛАТІ няйт да дук.
0055	ADV	быдла	быдла-ті	NA	tra	NA	NA	NA	NA	NA	NA	NA	kaikkialta	NA	NA	быдлаті	Мукӧддырйиыс пыктытӧдзыс морттӧ биалӧ да кынтӧ, а кор быттьӧ мортыд мудзӧма, жуялӧма, быттьӧ БЫДЛАТІ сылӧн висьыштӧ сы бӧрын и висьмӧны суставъясыс.
0056	ADV	быдла	быдла-ті	NA	tra	NA	NA	NA	NA	NA	NA	NA	kaikkialta	NA	NA	быдлаті	Налӧн БЫДЛАТІ сӧстӧм да пельк.
0057	ADV	быдла	быдла-ті	NA	tra	NA	NA	NA	NA	NA	NA	NA	kaikkialta	NA	NA	быдлаті	Пӧсь дозйыд кӧдзыд васьыд кутас зэв ӧдйӧ чинны, топавны; оз ӧткодя БЫДЛАТІ чин, дорыс ньӧжйӧджык чинӧ; сы понда потласьӧ дозйыд.
0058	ADV	быдла	быдла-ті	NA	tra	NA	NA	NA	NA	NA	NA	NA	kaikkialta	NA	NA	быдлаті	Ручнӧй прессъяслӧн тырмытӧмторъясыс: оз БЫДЛАТІ ӧткодя лэччы пӧвйыс, дай вильдалӧны скрепаясыс (уджалігӧн стержень кутысь муфтаяс), а медся главнӧйыс — зэлыда да не пасьтала ӧткодя турун сюялӧмӧн прессовальнӧй камераяс унаысь жугавлӧны.
0059	ADV	быдла	быдла-ті	NA	tra	NA	NA	NA	NA	NA	NA	NA	kaikkialta	NA	NA	быдлаті	Сийӧс-заводыд вӧлыдлӧн медым вӧлі БЫДЛАТІ лючки-ладнӧ, медым некыт эз зырт, эз дойд.
0060	ADV	быдла	быдла-ті	NA	tra	NA	NA	NA	NA	NA	NA	NA	kaikkialta	NA	NA	быдлаті	Сідзтӧ челядьлӧн БЫДЛАТІ ёна мудзӧ, медъёна бара жӧ нервнӧй системаыс.
0061	ADV	быдла	быдла-ті	NA	tra	NA	NA	NA	NA	NA	NA	NA	kaikkialta	NA	NA	быдлаті	Сы вӧсна вуджана висьӧмӧн висьысьлӧн оз сӧмын висьмӧминыс вись, а БЫДЛАТІ: мортыд быттьӧ пыр зэв ёна мудзӧма, оз сёйсьы ни юсьы.
0062	ADV	быдла	быдла-ті	NA	tra	NA	NA	NA	NA	NA	NA	NA	kaikkialta	NA	NA	быдлаті	Тушаыс видзӧднысӧ мед вӧлі БЫДЛАТІ лӧсьыд статя.
0063	ADV	быдла	быдла-ті	NA	tra	NA	NA	NA	NA	NA	NA	NA	kaikkialta	NA	NA	быдлаті	Шыблалӧмӧн кӧдзигӧн кӧйдыссӧ тыртӧны му пытшкас пиняясӧн (агасъясӧн), мукӧд тусьяс вылӧ муыс воӧ кызджыка, мукӧдӧ — пелькджыка, кытчӧ и дзик оз веськавлы — оз БЫДЛАТІ ӧтмоза вевттьысь мунас.
0064	NOUN	потас	потас-ъяс-ӧд-ыс	pl	prl	TRUE	Aukko	NA	NA	NA	NA	NA	voi kivuta puhkeamien kautta	вермӧ каттьысьны	NA	потасъясӧдыс	Сэтшӧм розьясӧдыс, ПОТАСЪЯСӦДЫС пытшкӧс ва му пытшкысь вермӧ ньӧжйӧникӧн каттьысьны вывлань
0065	NOUN	розь	розь-яс-ӧд-ыс	pl	prl	TRUE	Aukko	NA	NA	NA	NA	NA	voi kivuta reikien kautta	вермӧ каттьысьны	NA	розьясӧдыс	Сэтшӧм РОЗЬЯСӦДЫС, потасъясӧдыс пытшкӧс ва му пытшкысь вермӧ ньӧжйӧникӧн каттьысьны вывлань
0066	ADP	выв	выв-ті	sg	tra	FALSE	Tila	NA	NA	NA	NA	NA	(hevonen) voi vetää maaperää pitkin	вермӧ кыскыны	мусин	вывті	Улынджык индӧм таблица петкӧдлӧ, уна-ӧ груз уна сикаса мусин ВЫВТІ вермӧ кыскыны вӧв.
0067	ADP	выв	выв-ті	sg	tra	FALSE	Väylä	NA	NA	NA	NA	NA	(hevonen) voi vetää tietä pitkin	вермӧ кыскыны	туй	вывті	Бур туй ВЫВТІ да шойччышталӧмӧн вӧв вермӧ кыскыны 100 пудъя додь 20 километр сайӧ 5 часӧн.
0068	ADP	выв	выв-ті-ыд	sg	tra	TRUE	Väylä	NA	NA	NA	NA	NA	(hevonen) voi vetää tietä pitkin	вермӧ кыскыны	туй	вывтіыд	Бур туй ВЫВТІЫД вӧлыс вермӧ кыскыны 75 пудйӧдз.
0069	NOUN?	выла	выла-ті	sg	tra	FALSE	Tila	NA	NA	NA	NA	NA	voi lentää (2000 km) kauemmas	вермӧ лэбзьыны	NA	вылаті	Моторъясыслы ломтысянсӧ босьтӧ 10 час лэбалӧм вылӧ, вермӧ лэбзьыны 2000 метр ВЫЛАТІ.
0070	ADP	выв	выв-ті	sg	tra	FALSE	Väylä	NA	NA	NA	NA	NA	(vaunut) voivat mennä kiskoja pitkin	вермӧны ветлыны	рельсъяс	вывті	Паравоз да вагонъяс вермӧны ветлыны сӧмын рельсъяс ВЫВТІ.
0071	NOUN	туй	туй-ӧд	sg	prl	FALSE	Väylä	NA	NA	NA	NA	NA	(ihmiset) kykenevät menemään tietä pitkin	вермӧны мунны	NA	туйӧд	Ловъя торъяс, йӧз вермӧны сӧмын дась ТУЙӦД мунны, шыльыда мунны; туйсӧ вежны найӧ некор оз вермыны.
0072	NOUN	ӧдзӧс	ӧдзӧс-ӧд-ыс	sg	prl	TRUE	Aukko	NA	NA	NA	NA	NA	(kananpojat) voivat mennä sisään ovesta	вермӧны пыравны	NA	ӧдзӧсӧдыс	Тайӧ ӦДЗӦСӦДЫС курӧгпиян вермӧны пыравны узьланінас да лунын шонтысьӧм могысь, сэті пыр шоныд.
0073	NOUN	вом	вом-ӧд-ыс	sg	prl	TRUE	Aukko	NA	NA	NA	NA	NA	voivat mennä sisään suusta	вермӧны пырны	NA	вомӧдыс	Сы вӧсна найӧ вермӧны пырны морт пытшкӧ ВОМӦДЫС, лолалігас; вермӧны пуксьыны сы вылӧ ветлӧдлігас.
0074	NOUN	розь	розь-ӧд-ыс	sg	prl	TRUE	Aukko	NA	NA	NA	NA	NA	(ilma) kulkeutuu reiästä (lehmien luo)	веськалас	NA	розьӧдыс	Сэки ывлавывса сӧстӧм сынӧдсӧ тӧлыс кутас пыртны трубаас вевдорса розьӧдыс, кодарсянь тӧлыс, трубасяньыс сэсся увдорса восьса РОЗЬӦДЫС сынӧдыс веськалас скӧт оланінад.
0075	NOUN	бронхи	бронхи-ӧд	sg	prl	FALSE	Väylä	NA	NA	NA	NA	NA	(ilma) kulkeutuu keuhkoputkea pitkin	веськалӧ	NA	бронхиӧд	Лолалігӧн сынӧдысь кислород сынӧд ветлан туйясӧд — БРОНХИӦД — веськалӧ войдӧр ты гадьясӧ, сэсянь сэсся вӧсни кышӧдъяс пырыс вирӧ.
0076	NOUN	канава	канава-ті	sg	tra	FALSE	Väylä	NA	NA	NA	NA	NA	(uloste) kulkeutuu kanavaa pitkin	веськалӧ	NA	канаваті	Скӧтлӧн кизьӧр куйӧдыс веськалӧ чукӧртан жӧлӧбъясӧ да сы кузя визувтӧ чукӧртан люкъясӧ (17 серпас пасйӧма «А» шыпасӧн), тасянь сэсся вевта ыджыд КАНАВАТІ (магистральӧд) кизьӧртор веськалӧ куйӧд видзан юкмӧсӧ.
0077	NOUN	магистраль	магистраль-ӧд	sg	prl	FALSE	Väylä	NA	NA	NA	NA	NA	(uloste) kulkeutuu väylää pitkin	веськалӧ	NA	магистральӧд	Скӧтлӧн кизьӧр куйӧдыс веськалӧ чукӧртан жӧлӧбъясӧ да сы кузя визувтӧ чукӧртан люкъясӧ (17 серпас пасйӧма «А» шыпасӧн), тасянь сэсся вевта ыджыд канаваті (МАГИСТРАЛЬӦД) кизьӧртор веськалӧ куйӧд видзан юкмӧсӧ.
